{
  "name": "claude-alchemy-sdd",
  "version": "0.2.1",
  "description": "SDD (Spec Driven Development) for Claude Alchemy",
  "author": {
    "name": "Stephen Sequenzia",
    "email": "sequenzia@gmail.com",
    "url": "https://sequenzia.com"
  },
  "homepage": "https://github.com/sequenzia/claude-alchemy/tree/main/plugins/sdd",
  "repository": "https://github.com/sequenzia/claude-alchemy/tree/main/plugins/sdd",
  "license": "MIT",
  "keywords": [
    "claude-code",
    "spec-generation",
    "analysis",
    "skills"
  ]
}
