{
  "name": "claude-alchemy-agents",
  "version": "0.1.0",
  "description": "Custom agents for Claude Alchemy",
  "author": {
    "name": "Stephen Sequenzia",
    "email": "sequenzia@gmail.com",
    "url": "https://sequenzia.com"
  },
  "homepage": "https://github.com/sequenzia/claude-alchemy/tree/main/plugins/agents",
  "repository": "https://github.com/sequenzia/claude-alchemy/tree/main/plugins/agents",
  "license": "MIT",
  "keywords": ["claude-code", "agents"]
}
