{
  "name": "claude-alchemy-tools",
  "version": "0.2.2",
  "description": "Developer tools for feature development, Git workflows, and release automation",
  "author": {
    "name": "Stephen Sequenzia",
    "email": "sequenzia@gmail.com",
    "url": "https://sequenzia.com"
  },
  "homepage": "https://github.com/sequenzia/claude-alchemy/tree/main/plugins/tools",
  "repository": "https://github.com/sequenzia/claude-alchemy/tree/main/plugins/tools",
  "license": "MIT",
  "keywords": [
    "claude-code",
    "agents",
    "skills",
    "hooks",
    "rules",
    "tdd",
    "code-review",
    "workflow",
    "automation",
    "best-practices"
  ]
}
  